"amazon_swimsuits_woman_images_id","href","src","alt","marca","precio","direccion"
"1","https://amzn.to/46CxXjk","https://m.media-amazon.com/images/I/61A5rpxOQQL._AC_SX569_.jpg","LY4U Pantalones Cortos Deportivos Casuales para Hombre con Bolsillos con Cremallera en la Cintura Elástica","LY4U","19.99","frente"
"2","https://amzn.to/4mmzQFl","https://m.media-amazon.com/images/I/61ycn02yoRL._AC_SX679_.jpg","Tansozer Pantalones Cortos Hombre","Tansozer","23.79","frente"
"3","https://amzn.to/3IRV1AB","https://m.media-amazon.com/images/I/61A5rpxOQQL._AC_UF480,600_SR480,600_.jpg","Csqtongan Pantalones deportivos para hombre, pantalones cortos para hombre, pantalones cortos de verano, algodón, pantalones cortos de deporte, elásticos, para gimnasio, con bolsillo","Csqtongan","22.99","frente"
"4","https://amzn.to/44VM69T","https://m.media-amazon.com/images/I/51V8lb5FHvL._AC_UF480,600_SR480,600_.jpg","JustSun Pantalones Cortos Hombre Deporte Shorts Running con Cremallera","JustSun","30.99","frente"
"5","https://amzn.to/4fcBqXM","https://m.media-amazon.com/images/I/61JXEdgTDqL._AC_UF480,600_SR480,600_.jpg","Csqtongan Pantalones cortos de verano para hombre, pantalones cortos deportivos de algodón, para gimnasio, correr, elásticos, con bolsillos","Csqtongan","20.99","frente"
"6","https://amzn.to/45fo7l6","https://m.media-amazon.com/images/I/41S0X85MNmS._AC_UF480,600_SR480,600_.jpg","Tansozer Pantalones Cortos Hombre Deporte Running","Tansozer","25.49","frente"
"7","https://amzn.to/4fplTEo","https://m.media-amazon.com/images/I/61HZmUu3vhL._AC_SX679_.jpg","ZOXOZ Pantalones Cortos para Hombre Deporte con Cremallera Algodon Shorts","ZOXOZ","29.95","izquierda"
"8","https://amzn.to/4mstWCJ","https://m.media-amazon.com/images/I/61X98UwRjpL._AC_SY741_.jpg","TACVASEN Hombres 100% Algodón Pantalones Cortos de Carga 3/4 Casual Pantalones Cortos Militares al Aire Libre con Muchos Bolsillos","TACVASE","41.98","derecha"
